content,platform,time
质量非常差,豌豆荚,2017-10-2020:00:07
之前很好用，现在是什么鬼啊！！,小米应用商店,2017-12-1918:58:11
真烂啊，各种麻烦，还有好多没用的信息，服了,360手机助手,2017-11-2920:19:57
这个头条不如以前了，有一半是视频了，12月31号果断卸载了。,小米应用商店,2017-12-3107:30:52
这个软件监听电话，即使权限全部关闭情况下！！！！！垃圾,豌豆荚,2017-10-1913:32:37
怎么登不上了？,vivo应用商店,2017-12-1918:37:38
一入神坑逃不出,小米应用商店,2017-11-1720:19:23
悟空问答就是弱智集中营，一堆白痴问题邀请你回答，你要难得遇到一个能算问题的认真回答了，立刻被无耻之徒一字不漏抄袭而且它还被推荐。反应问题就会答非所问推卸责任。果断卸了。,小米应用商店,2017-12-2614:05:32
无法下载,豌豆荚,2017-10-2221:42:18
卧槽我为啥QQ登陆不了了垃圾死了,应用宝,2017-12-1919:32:53
卧槽官方你是怎么了？这为什么不能卸载我操你tmd到底是在吃干饭的吧。弄个不能卸载的东西，你让我们下的还安心吗？我也是你妈的醉了。以后这种东西千万不要再放出来了。再放出来我就让你全部好看。,360手机助手,2017-12-2217:28:30
卧槽，怎么用不了了？,小米应用商店,2017-12-1918:49:22
我也是无语了，广告插入越来越多,小米应用商店,2018-01-0223:27:07
文章水平质量垃圾,豌豆荚,2017-10-2213:55:03
为什么这两天老是闪退呢,应用宝,2017-11-2911:37:48
为啥老是闪退,豌豆荚,2017-12-2218:21:00
微头条总出现！！！！差差差差差！！！,小米应用商店,2018-01-0314:11:42
特卖没以前好用了,vivo应用商店,2017-11-0200:47:19
首页居然两个视频入口，垃圾,小米应用商店,2017-12-1919:16:51
视频太短，发的坑人，差评,vivo应用商店,2017-12-1010:53:17
删了删了，一星都不想给,小米应用商店,2017-11-0519:34:35
傻比玩意，升级后，桌面插件没了。有什么用，删了,豌豆荚,2017-10-2201:50:38
呸！为了建立和谐社会新版删除了社会分栏我呸！掩耳盗铃么？一星拿走不谢,AppStore,2018-01-0118:49:00
你密集恐惧,vivo应用商店,2017-12-0918:05:00
尼玛币的以前版本可以下载视频，升级就不行了，太他妈的烂了,小米应用商店,2017-11-2411:58:44
内容质量真是太差了,豌豆荚,2017-10-2213:28:11
内容垃圾,豌豆荚,2017-10-2111:34:48
吗的更新后桌面插件都没了,豌豆荚,2017-10-2222:32:03
妈的下载下来还删不了，有毒的软件不要下载,应用宝,2017-11-2419:57:16
流氓软件，跟小米视频一起坑人，莫名其妙就下载安装了,小米应用商店,2017-12-0122:43:40
垃圾软件,应用宝,2017-12-2715:08:15
垃圾好，提示音能关吗,豌豆荚,2017-10-1501:01:16
垃圾广告平台，明明屏蔽了好多电商广告，还是一个劲的给我推送，当当bitch还要立牌坊，垃圾软件,小米应用商店,2017-11-0307:14:26
垃圾更新后不推送了…？,豌豆荚,2017-10-1707:27:55
垃圾东西全是小米水军,小米应用商店,2017-12-1920:20:37
垃圾，总是弹广告。。。,豌豆荚,2017-10-1800:58:47
垃圾，一个实名认证提交上百次都通不过,小米应用商店,2017-11-0817:14:09
垃圾，半年前的新闻也叫新闻，重重复复,豌豆荚,2017-10-2209:33:03
垃圾，，水军狗屎粪之地，。,应用宝,2017-12-1719:34:47
垃圾！,豌豆荚,2017-10-2106:36:13
垃圾。,豌豆荚,2017-10-1906:11:47
垃圾,小米应用商店,2017-12-1919:13:50
看视频闪退？垃圾,小米应用商店,2017-12-2000:12:40
卡卡卡卡卡iphone7看视频点评论啊切下一个卡到爆,AppStore,2017-11-2501:07:16
毫无知识产权可言,豌豆荚,2017-10-2001:07:20
非常鄙視這個軟件，在甚麼地方都能看到，還強制下載無法停止，噁心，非常鄙視,豌豆荚,2017-10-2303:03:44
登录了头像疑似违规或存在未知风险被永久封禁？？？他麻麻腾训都不封我头像你说违规，神经东西，滚你麻麻的**,vivo应用商店,2017-12-1511:16:23
大学老师说全是假新闻、垃圾新闻。,小米应用商店,2017-12-0319:09:30
操闪屏！垃圾,360手机助手,2017-12-2520:33:34
呸！为了建立和谐社会新版删除了社会分栏我呸！掩耳盗铃么？一星拿走不谢,AppStore,2018-01-0118:49:00
卡卡卡卡卡iphone7看视频点评论啊切下一个卡到爆,AppStore,2017-11-2501:07:16
iOS11iPhone6无法登录RT,AppStore,2017-10-0119:14:56
广告一堆缓存清理不干净没以前好各种视频直播推荐关注越来越利益化了。赶紧下架吧恶心的商人,AppStore,2017-09-1811:42:48
烂东西更新之后卡的要死还闪退沙壁东西更新nmlg臭b,AppStore,2017-09-1610:11:21
越更新越差！越更新越差！老子要疯了！上面直接有关注和下面有＋号！我草是嫩娘的！,AppStore,2017-09-1515:28:44
广告！垃圾App。,AppStore,2017-09-1214:18:02
真卡越更新越卡一星都不想给,AppStore,2017-09-1109:06:10
越做越烂今日头条的开发长点心吧，做的什么烂东西，与第三方微博连不上了没发现么？内容越来越烂都不做优化筛选了。界面设计一百年没优化过了，一堆乱七八糟的营销账号。原来挺好的app让你们这群白痴越做越烂。,AppStore,2017-09-1019:17:48
垃圾版本垃圾版本,AppStore,2017-09-0117:09:17
这玩意千万别下，垃圾啊，还有人管了没？广告，各种bug，卧槽啊，一块钱喂狗了,AppStore,2017-08-2715:51:19
垃圾软件有广告，垃圾头条,AppStore,2017-07-2721:42:08
视频和声音不同步越更新越垃圾！声音和视频不同步，卡的要死！广告特多！不建议下载个更新！,AppStore,2017-07-1522:09:28
广告又有了刚夸完没广告，结果就又上线广告了。垃圾，花钱买pro来看广告来了,AppStore,2017-06-1311:14:22
闪退闪退无止尽越更新越垃圾,AppStore,2017-05-1914:54:37
垃圾跟免费版一样，这个还要钱，都是标题党，果断卸载，小编都是吃s的。,AppStore,2017-02-2412:27:39
垃圾??????????????,AppStore,2017-02-0700:56:18
垃圾?????????????,AppStore,2017-02-0401:45:13
垃圾v5v5,AppStore,2017-01-2421:41:47
坑人链接不了网络，根本用不了,AppStore,2017-01-2217:47:52
垃圾HhhhHhhhhh,AppStore,2017-01-1913:13:28
闪退刚刚更新完老是闪退啊,AppStore,2017-01-1210:23:00
垃圾????,AppStore,2017-01-1112:11:35
闪退现在点开两秒就闪退，垃圾更新！,AppStore,2017-01-0610:53:36
说句实话真不好用自从更新没以前好用,AppStore,2017-01-0503:25:07
垃圾更新闪退啊，我的哥,AppStore,2017-01-0414:49:04
垃圾更新以后不停的闪退,AppStore,2017-01-0414:29:55
垃圾浪费我钱买这垃圾,AppStore,2017-04-0113:07:12
审核你麻痹,应用宝,2017-10-2913:57:30
付费花钱买这个软件就是为了不看新闻，结果越做越垃圾，都是虚假信息和淘宝购物，垃圾。,AppStore,2017-03-1015:41:25
闪退的垃圾垃圾,AppStore,2017-01-0414:53:00
垃圾头条千万不要买1??元拿去买药吃,AppStore,2017-03-2403:30:49
全是水文，垃圾文lowb看的玩意儿,AppStore,2017-12-1311:43:30
全是水文，垃圾文lowb看的玩意儿,AppStore,2017-12-1311:43:30
闪退闪退闪退进去就闪退，根本不能用,AppStore,2017-01-0610:55:22
离线下载呢？？离线下载呢？？？？？？被狗吃了吗？,AppStore,2017-10-1801:00:44
离线下载呢？？离线下载呢？？？？？？被狗吃了吗？,AppStore,2017-10-1801:00:44
提示发现新功能，点了以后把我的通讯录导走了，这是赤裸裸的欺骗，也太无耻了,豌豆荚,2017-10-2311:08:36
侵权，标题党，广告，垃圾,豌豆荚,2017-10-2102:41:53
用小米音乐听真是防不胜防啊，有点了，那我给你写差评吧,小米应用商店,2017-12-0814:50:35
**的玩意，**,vivo应用商店,2018-01-0813:31:04
****的玩意,vivo应用商店,2018-01-0723:45:47
垃圾垃圾垃圾垃圾垃圾垃圾垃圾垃圾垃圾广告狗广告狗广告狗??,AppStore,2017-06-0219:46:37
充斥着各种虚假新闻标题,小米应用商店,2017-12-3016:39:16
赶紧把这该死的上划刷新改了,小米应用商店,2017-11-1910:59:08
该死的西瓜视频广告该死的西瓜视频广告,AppStore,2017-07-0512:32:18
更新后广告关不掉，无耻至极,豌豆荚,2017-10-2210:44:57
垃圾垃圾软件视频卡的一笔,AppStore,2017-03-1923:32:48
糟糕,豌豆荚,2017-10-2108:11:43
无脑的文章，糟糕的评论。,豌豆荚,2017-10-2016:15:57
更新换代体验糟糕,小米应用商店,2017-12-1919:07:08
不对不对你,豌豆荚,2017-10-2214:44:50
垃圾，骗人的打开一直无网络,AppStore,2017-01-2401:00:14
新浪微博怎么不好登陆了，成天瞎升级越升越垃圾！,360手机助手,2017-11-2019:41:56
地方频道删不掉什么鬼为什么地方频道明明删掉，还是跟毒瘤一样又出现了,AppStore,2017-12-2920:46:11
地方频道删不掉什么鬼为什么地方频道明明删掉，还是跟毒瘤一样又出现了,AppStore,2017-12-2920:46:11
**，都是些低俗假新闻,vivo应用商店,2017-11-1218:45:15
总推送恶心的蛇和人尿尿,360手机助手,2017-10-1711:36:47
恶心的新闻,豌豆荚,2017-10-2221:40:31
4.9版异常耗电，还有那个恶心的底栏！,豌豆荚,2017-10-2207:29:50
别更新…一只闪退，最恶心的一次……,AppStore,2017-01-0612:40:52
更新了还是有广告烂烂烂,AppStore,2017-09-2007:42:38
问答换了新版打不开了？,360手机助手,2017-11-0311:33:41
打不开了为毛为毛打不开了,AppStore,2017-08-3114:16:31
闪退今天更新完就打不开了，打开3秒就闪退。,AppStore,2017-01-0413:52:29
无聊就看,小米应用商店,2017-12-1419:55:42
这个新版本一直闪退我去这个版本怎么一直闪退呢。要么连不上网要么黑屏搞死人了。看来我要换一个软件了。,AppStore,2017-01-1907:50:22
内容太差，大多是标题党,小米应用商店,2017-11-0413:50:42
iPad适配太差le如题,AppStore,2017-11-0520:02:38
iPad适配太差le如题,AppStore,2017-11-0520:02:38
太多劣质自媒体，广告多，红红的背景很丑。,小米应用商店,2017-10-3018:04:18
垃圾啊浪费钱一星都不想给mlgb,AppStore,2017-08-0715:20:34
界面丑死了，果断卸载了,豌豆荚,2017-10-2215:11:37
一天不看头条就难受,vivo应用商店,2018-01-0115:46:35
每天不刷个3小时浑身难受,小米应用商店,2018-01-0219:56:06
额太可怜了,豌豆荚,2017-10-2217:55:29
改版的头条太垃圾了,小米应用商店,2018-01-0215:38:10
连不上网太垃圾了，买了之后下载了，连不上网,AppStore,2017-02-2120:22:26
太恶心了，,豌豆荚,2017-10-2019:17:30
他妈的，把号给我封了,应用宝,2017-12-3106:42:22
很垃圾、打算做自媒体的朋友千万别选头条、一个月的新手刚过号就被封没有任何理由、帮头条白劳动一个月、草泥马、各位千万别入坑、,小米应用商店,2017-12-2411:59:44
闪退，赶紧修复闪退啊，大哥，体验非常差，而且是高频闪退,AppStore,2017-05-2611:18:57
一点都不好。,豌豆荚,2017-10-2205:07:59
有bug吧，好烦,vivo应用商店,2017-12-2918:29:19
好烦,豌豆荚,2017-10-2009:09:56
真特码垃圾软件，动不动就给你封禁账号,应用宝,2017-11-1311:27:25
他他不阿布踏踏了他阿里它不他5不痛苦邋遢痛苦他图踏踏吧,vivo应用商店,2017-11-3007:38:12
太多地域攻击的人没素质,vivo应用商店,2017-10-2314:30:57
垃圾垃圾中的战斗机，一个东西只是开始好，后来越来越垃圾，推送的新闻内容垃圾到你妈家去，而且越来越低俗,AppStore,2017-08-0900:26:31
今日头条就是垃圾，动不动就封号！,360手机助手,2017-10-1312:13:10
垃圾垃圾中的战斗机，一个东西只是开始好，后来越来越垃圾，推送的新闻内容垃圾到你妈家去,AppStore,2017-07-0709:02:33
更新了闪退什么玩意啊,AppStore,2017-01-0414:54:18
TMDb！从苹果上下载的用了几年了从十一月份至今用QQ登录帐号己被改，反应至今要了我的电话可还是没用！MLB，去死吧！,应用宝,2017-12-0320:57:50
有你不寂寞。,小米应用商店,2017-11-1721:40:10
秒退更新后进去秒退啊，有点崩溃！！！,AppStore,2017-01-0414:06:22
垃圾虚假宣传的太多了新闻头条快变成广告圈了，卖假表的铺天盖地，明不张胆的宣传，头条里的管理者都哪去了？？？我们是看新闻的，不是广告，同时也请记住你们的初心是为了新闻。,AppStore,2017-09-0611:11:04
不看头条睡不着,应用宝,2018-01-0119:20:39
越来越垃圾懒得多说话了，更新一次失望一次,AppStore,2017-07-2301:22:47
我就想知道这跟普通版有什么区别？比丢了一块钱还难受？,AppStore,2017-01-1923:24:25
不好,豌豆荚,2017-10-2314:00:06
每看完一个视频，都要放一遍百万答题能挣钱这个广告真**烦人,vivo应用商店,2018-01-0800:14:25
越来越垃圾广告越来越多，果断卸载！,AppStore,2017-09-1505:43:06
垃圾新闻质量是越来越差，错别字，老旧重复新闻，毫无价值的一大堆，评论区也低俗，,AppStore,2017-03-2212:06:13
一块钱？不值！！！！！！！！,AppStore,2017-01-1804:15:34
为什么看不了评论了要你何用?,小米应用商店,2017-12-1918:23:36
更新之后，打开一会儿就崩溃了。更新之后会崩溃,AppStore,2017-01-0414:22:48
一点都不好，有时候打不开,vivo应用商店,2017-11-1418:25:36
越更越垃圾了，广告变多了，1块钱白花了？越更越垃圾了，广告变多了，1块钱白花了？,AppStore,2017-06-1311:39:06
**玩意有毛病的,vivo应用商店,2017-12-0712:29:37
不好，内容质量差。。。。,豌豆荚,2017-10-2111:54:04
头条越来越不要脸pro也开始玩广告，欺骗消费者，祝你们早点倒闭,AppStore,2017-06-1317:43:39
太费电了，都不好用了太费电了，都不好用了，不敢用了,AppStore,2017-10-0807:52:50
头条广告多，头条视频也看不了，太差了，一星都不想给,小米应用商店,2017-12-3116:10:00
一点也不好,豌豆荚,2017-10-2308:23:10
不尊重版权的无良媒体,豌豆荚,2017-10-2211:15:02
下的不快,豌豆荚,2017-10-2222:08:49
好像崩溃了,vivo应用商店,2017-12-1919:43:26
服务器崩溃了吗,小米应用商店,2017-12-1918:17:53
头条怎么崩溃了头条怎么崩溃了,AppStore,2017-01-0610:47:29
内容质量差！差！差！！！,豌豆荚,2017-10-2213:22:50
没用处。,豌豆荚,2017-10-2022:17:45
垃圾货。我付了钱为什么还要有广告。内容质量差垃圾货。我付了钱为什么还要有广告，内容质量越来越差了。祝早日下架关门。,AppStore,2017-06-1309:35:54
我的也看不了评论了，怎么回事,vivo应用商店,2017-12-1918:51:05
为什么看不了评论,豌豆荚,2017-10-1311:03:01
为什么今日头条的视频都看不了,小米应用商店,2017-12-3118:57:55
为啥我的看不了视频,vivo应用商店,2018-01-0522:35:43
突然看不了评论了,小米应用商店,2017-12-1918:48:35
头条今天怎么了，看不了评论,小米应用商店,2017-12-1919:30:15
视频都看不了。。。留你何用,小米应用商店,2017-12-2000:27:13
看视频都看不了,小米应用商店,2017-12-2000:33:06
看不了评论了,小米应用商店,2017-12-1918:52:11
看不了评论,小米应用商店,2017-12-1919:19:36
今天看不了评论为啥啊！,vivo应用商店,2017-12-1918:56:07
视频看不了这次更新后视频一直看不了，难道就我有这种情况？,AppStore,2017-02-2806:43:13
闪退更新后一直闪退，简直看不了，怎么回事？,AppStore,2017-01-0612:26:29
新版本更新后视频看不了，千万别更新新版本更新后视频看不了，千万别更新！新版本更新后视频看不了，千万别更新！新版本更新后视频看不了，千万别更新！新版本更新后视频看不了，千万别更新！新版本更新后视频看不了，千万别更新！新版本更新后视频看不了，千万别更新！,AppStore,2017-01-0715:10:52
我去,vivo应用商店,2017-12-0523:00:57
垃圾，看视频闪退，试了多少次都不行,小米应用商店,2017-12-2000:06:11
今天什么情况真恶心，添加频道都不行,vivo应用商店,2017-11-2318:58:58
今日头条刚有点人气就这么牛掰了！想上传一个视频都不行必须给钱才行！原来还有这种潜规则！垃圾垃圾垃圾垃圾垃圾,应用宝,2017-10-2823:56:42
好垃圾啊，每次评论都有转发到微博，麻烦死了垃圾版本，用了头条这么久，这个版本最垃圾了,AppStore,2017-09-0315:38:29
我去你大爷的,小米应用商店,2017-12-2918:28:41
闪退更新了之后闪退太差劲了,AppStore,2017-01-0612:38:41
现在全特么是自媒体，天天发些没用的辣鸡，屁大点无聊的事也要发条新闻，真是越来越辣鸡,小米应用商店,2017-11-0503:28:58
你妹的，刚下载就让更新，坑爹的玩意儿,应用宝,2017-11-1005:20:29
还不如不更新来越更新越差一点不好用了,豌豆荚,2017-10-2305:21:27
这几天新闻内容二级链接打不开，帐号收藏等也一样，卸载重新安装连帐号也连不上了。,360手机助手,2017-12-0817:02:58
怎么打不开视频,vivo应用商店,2017-12-1923:58:27
打不开,vivo应用商店,2017-10-2014:18:48
更新后打都打不开。什么情况！换软件了。,AppStore,2017-09-1821:28:56
什么鸟，打不开。页面打不开，始终显示网络连接不上。,AppStore,2017-02-2801:38:47
更新后打不开自动更新后总停留在等待中，打不开,AppStore,2017-01-1222:35:09
各种删回复删评论新闻评论各种删回复删评论，只让叫好，不让说差，粉饰太平误导视听，没有社会责任感的辣鸡平台,AppStore,2017-03-0609:49:36
**软件，好不容易过的新手期无缘无故封我的号。问客服也不理，店大欺客，祝你们早日倒闭。,vivo应用商店,2017-12-1517:12:36
今天更新完系统就不能播放视频就会卡住5s另外一台六没事。,小米应用商店,2017-12-2000:22:36
有错别字啊有错字,AppStore,2017-01-3003:19:39
我只是想来看看关于侵权的事，然而评论区一片叫好。,豌豆荚,2017-10-2207:17:41
闪退越更新越差，动不动就黑屏，要重新打开才行,AppStore,2017-11-0310:15:41
辣鸡！动不动就闪退,360手机助手,2017-12-1008:55:15
闪退越更新越差，动不动就黑屏，要重新打开才行,AppStore,2017-11-0310:15:41
超垃圾！太他喵的垃圾了，有那么多广告就算了，文章打不开，天天看广告，1元已喂狗！,AppStore,2017-06-0817:37:48
每次只能刷新4条新闻除了没有广告，每次刷新只能刷新出4条吧，翻一下就到刚才看的了，很烦。,AppStore,2017-12-1115:12:38
每次只能刷新4条新闻除了没有广告，每次刷新只能刷新出4条吧，翻一下就到刚才看的了，很烦。,AppStore,2017-12-1115:12:38
不想多说什么,小米应用商店,2017-12-1420:08:22
AZ539，我被人坑了，你们别被坑了，这个只能复活一次，好惨,小米应用商店,2018-01-0621:29:21
更新打不开了，稀烂，垃圾更新后打不开了，垃圾,AppStore,2017-01-0611:11:09
越来越差微博账号无法登录了，还我收藏来,AppStore,2017-09-1723:48:32
好气啊，我还以为我的出毛病了，我安装了四五次,vivo应用商店,2017-12-1919:32:34
太失望了和普通版的没啥区别，虽然一元不多，但是太伤人了，极度差评,AppStore,2017-11-0121:31:57
太失望了和普通版的没啥区别，虽然一元不多，但是太伤人了，极度差评,AppStore,2017-11-0121:31:57
最低只能给一颗心啊开始有广告了，这是收费版啊，居然有广告了,AppStore,2017-06-3021:19:13
辣鸡辣鸡广告又出来了几个意思，看到的都别买,AppStore,2017-11-2423:40:21
辣鸡辣鸡广告又出来了几个意思，看到的都别买,AppStore,2017-11-2423:40:21
作死呀!可惜,豌豆荚,2017-10-2213:12:03
太差劲,豌豆荚,2017-10-2212:40:01
一点都不好用，内容少，真不明白为什么这么多用，还是换回网易新闻。,豌豆荚,2017-10-2222:14:13
安不了怎么办？,豌豆荚,2017-10-2008:08:00
今日头条已经变成大垃圾站一星都不想给，今日头条现在已经沦落成新闻大垃圾站，各种不负责任的小野报，头条号、标题党、鬼故事轮番上阵。看它简直是浪费时间，浪费生命！,AppStore,2017-11-2600:12:06
今日头条已经变成大垃圾站一星都不想给，今日头条现在已经沦落成新闻大垃圾站，各种不负责任的小野报，头条号、标题党、鬼故事轮番上阵。看它简直是浪费时间，浪费生命！,AppStore,2017-11-2600:12:06
新闻质量不行,豌豆荚,2017-10-2222:33:49
太多段子过于低俗段子有性暗示没关系，但是不要那么低俗没品味吧,AppStore,2017-01-0818:38:32
今天头条是不是有病啊,小米应用商店,2017-12-2920:58:20
超垃圾！有那么多广告就算了，文章打不开，天天看广告，1元已喂狗！,AppStore,2017-06-0508:45:07
评论都发不了退出账号还退不了,vivo应用商店,2017-12-1918:14:21
更新后卡死了更新后卡死了，图片视频都加载不出来,AppStore,2017-09-1915:32:51
更新以后卡死了更新以后卡死了,AppStore,2017-09-0716:15:30
什么鬼，联网不上了搞什么鬼，普通版也连不上了,AppStore,2017-01-0611:06:23
真的垃圾软件，自己天天喊着原创原创其实百分之八十多是抄袭的，注册个头条号好不容易过新手期做了好几天有收益了，他妈的封我的号，问客服也不理我垃圾软件祝你早日倒闭。,应用宝,2017-12-1517:09:18
口水文多的爆啊全是标题党，内容也太过低俗，无用！还有你们的安卓版，更是糟糕，广告就直接嵌入到文章中，你们是穷疯了嘛！,AppStore,2017-12-1709:51:01
口水文多的爆啊全是标题党，内容也太过低俗，无用！还有你们的安卓版，更是糟糕，广告就直接嵌入到文章中，你们是穷疯了嘛！,AppStore,2017-12-1709:51:01
文章水平太差了！,豌豆荚,2017-10-2222:07:02
太差了~_~,豌豆荚,2017-10-2211:22:01
越来越垃圾，广告越来越多，视频也发不了了,小米应用商店,2017-10-2423:19:30
今日头条已经变成大垃圾站今日头条现在已经沦落成大新闻垃圾站，各种不负责任的小野报，头条号、标题党、鬼故事轮番上阵。看它简直是浪费时间，浪费生命！,AppStore,2017-10-1523:15:29
今日头条已经变成大垃圾站今日头条现在已经沦落成大新闻垃圾站，各种不负责任的小野报，头条号、标题党、鬼故事轮番上阵。看它简直是浪费时间，浪费生命！,AppStore,2017-10-1523:15:29
重复的新闻太多，有点厌烦了。PS:怎么在这评论的都是vivo手机？,vivo应用商店,2017-11-1900:04:38
垃圾，全是喷子,小米应用商店,2017-12-0123:24:58
更新之后广告太多了有点垃圾,豌豆荚,2017-10-2023:57:47
广告太多了打开每个新闻都有广告，除了封面没有，和免费版有什么区别？大家千万不要买，看看评分就知道了,AppStore,2017-06-1308:59:53
广告太多！垃圾！广告太多！垃圾！,AppStore,2017-04-2914:05:18
看不了评论，卸载了重新下载，然后就根本登登不上去了,vivo应用商店,2017-12-1918:52:55
ipad版体验太差了iPad版体验太差了，望尽快优化,AppStore,2017-05-1611:20:40
这个版本太差了？为什么升了这个版本出现上滑不跟手，迟钝，闪屏，GIF播放闪退？,AppStore,2017-04-0809:32:15
广告pro版本当初花钱买的时候不是说没广告的嘛。。。怎么现在文章结尾还有广告。不诚信,AppStore,2017-06-1309:40:28
垃圾，标题党越来越多，无良小编越来越多，凑字数，骗稿费的作者越来越多，这个app快完蛋了,小米应用商店,2017-11-0807:46:22
挑战不可能,豌豆荚,2017-10-2217:07:23
广告太多了千万别买！！全是广告！,AppStore,2017-06-1614:20:42
喷子越来越多，真是什么智商的人都有，看着心烦,小米应用商店,2017-12-2618:03:34
垃圾头条，把社会频道取消了，还是新闻应用吗，弄个狗屁问答，各种黑，各种舔，各种审核不同过，垃圾头条，不敢当人民的发声器，要你何用，死了吧,小米应用商店,2018-01-0518:17:41
评论加载不出，以为坏了，卸载重下，现在倒好，登不上去了,vivo应用商店,2017-12-1918:52:53
感觉不对了,小米应用商店,2018-01-0523:54:50
闪退闪退比版本闪退，根本都用不了。,AppStore,2017-01-0414:08:11
广告太多！大多骗人的广告,应用宝,2018-01-0709:44:29
新版本不好用，好多功能都用不了了的。用旧版的。,豌豆荚,2017-10-2009:06:28
越更新越不好用！开发部门都是**的？,vivo应用商店,2017-12-1510:37:56
越更新越不好用,豌豆荚,2017-10-2715:41:40
视频变大不好用,小米应用商店,2017-11-2516:36:35
不好用，占内存，还删不掉,豌豆荚,2017-10-2017:04:02
不好用！不好用！不好用！,豌豆荚,2017-10-2215:04:28
不好用,豌豆荚,2017-10-2112:45:23
麻痹，更新了以后有广告，好垃圾。钱白花了。麻痹，更新了以后有广告，好垃圾。钱白花了。,AppStore,2017-05-1008:05:09
头条怎么了，显示空白,vivo应用商店,2017-12-2920:39:20
头条怎么了，我重新下载后，显示服务器维修中,vivo应用商店,2017-12-1918:54:23
