content,platform,time
会上瘾的头条身边很多朋友都被我安利用头条，我用的时间很久了，希望这个版本不要出现广告，虽然目前没有。,AppStore,2017-06-2319:51:56
可用,豌豆荚,2017-10-2120:55:08
好评，刷头条停不下来,小米应用商店,2018-01-0219:09:16
原来都登不了啊，这我就放心了,vivo应用商店,2017-12-1919:04:40
恢复正常了可以继续用了朋友们！,小米应用商店,2017-12-1920:20:21
更新后无限闪退更新后秒闪退，已经不能愉快的阅读了,AppStore,2017-01-0415:19:37
乱七八糟，很多广告，很多软文，标题党特多。,豌豆荚,2017-10-2305:26:51
付费确实是有优惠啊没有广告（虽然我就是个广告人）没有骚扰，能够用心看自己想了解的资讯，不错！,AppStore,2017-03-0523:21:00
好用！新版本解决了移动网络下不能刷新的问题，赞,AppStore,2017-01-2512:01:05
这种新闻很没营养麼,豌豆荚,2017-10-2214:23:34
这种新闻很没营养么,豌豆荚,2017-10-2100:20:33
老板，来评营养快线,小米应用商店,2017-11-1721:34:58
专业版为什么分享后显示社交版？为什么分享到微信等，显示使用社交版？,AppStore,2017-09-2415:03:31
买了个专业版，用自己微博登录上去发现被盗号了，大家要谨慎这软件盗号软件,AppStore,2017-03-2904:21:42
专业特别专业！,AppStore,2017-01-0220:38:24
好好抱抱！,小米应用商店,2018-01-0219:10:39
好好阿红,360手机助手,2017-12-1218:43:56
好好！,vivo应用商店,2017-10-1518:33:42
好好,豌豆荚,2017-10-2305:36:14
好好,豌豆荚,2017-10-1900:13:53
好好！,AppStore,2017-03-3000:38:38
好好,AppStore,2017-03-2818:14:47
好好app,AppStore,2017-01-1823:45:52
完美，底栏超级不好看。这样才是心中完美的样子，五星好评,豌豆荚,2017-10-2209:38:22
越办越好，希望每次刷新时出来的多一点，8条太少了,豌豆荚,2017-10-2220:04:08
升级后手机发热厉害的很,豌豆荚,2017-10-2209:03:12
这版本感觉发热厉害看视屏没几分钟手机就开始发烫,AppStore,2017-10-0814:12:40
火爆賺銭方法，正处风口，曰賺8百到3OOO，半年时间买车，每曰結算随时可提，力口君羊：178.5713（暗号:奔驰）领26块!,应用宝,2018-01-0618:32:54
咳咳，还好,vivo应用商店,2017-10-1411:48:42
还好，还好,豌豆荚,2017-10-2214:34:13
还好,豌豆荚,2017-10-2306:52:11
今日头条更新最新版本闪退上一个版本好着呢，更新到最新版本打开几秒钟就闪退不能用,AppStore,2017-01-0414:37:04
头条号关注上限到底是多少？关注上限之前是3000个，后来我多次反馈需要提高关注上限，有段时间变成5000个了，结果更新了几次版本以后，又关注不了新的头条号了！跪求给我增加关注上限！,AppStore,2017-12-2014:11:03
头条号关注上限到底是多少？关注上限之前是3000个，后来我多次反馈需要提高关注上限，有段时间变成5000个了，结果更新了几次版本以后，又关注不了新的头条号了！跪求给我增加关注上限！,AppStore,2017-12-2014:11:03
更好,豌豆荚,2017-10-2208:43:52
给头条app的一些小建议！谢谢满分，不过有些小建议，之前我在头条里边反馈了，但是没回复我，就是设置里的非wifi提醒，能不能增加个从不提醒，让我们自己选择，因为头条现在有免流卡，而且我也办理了，每次播放视频，她都提醒消耗多少流量干嘛的，我希望增加个从不提醒，另一个就是播放视频的清晰度可以在设置里设置，有时候无线网切换为4g视频清晰度自动变成标清了，还要在手动切换，希望采纳！！！！！！！！！！谢谢,AppStore,2017-09-2822:15:03
能不能快点适配X？？？？？？？？？？？？？？？？加油啊！！！！！！,AppStore,2017-11-0510:42:10
能不能快点适配X？？？？？？？？？？？？？？？？加油啊！！！！！！,AppStore,2017-11-0510:42:10
一个人的时候，陪伴我的，只有头条,小米应用商店,2017-12-1421:07:24
哇塞可以免费看小说可以看电视不错不错。,vivo应用商店,2017-11-2523:05:12
不得不说几句AppleStore的付费制度还是很棒的，很多一元钱的客户端就能享受到无广告的优质服务，为何不买呢！一元钱都舍不得花的又能做啥呢？,AppStore,2017-09-2718:23:04
好好的,小米应用商店,2017-12-2322:29:16
越改越烂，为什么推荐不了了？？？,小米应用商店,2017-12-3017:37:32
推荐更新不了,小米应用商店,2017-12-2921:12:43
咋么样给关注的人发视频？？？求大神,vivo应用商店,2017-11-0907:50:26
大神了,360手机助手,2017-12-2720:31:48
不断进步中…一个ID多个设备要统一推送习惯。这软件在进步…由骂转赞，背后的人辛苦了??一个ID很可能拥有多个IOS设备，而现在，每个设备都被看成“另一个人”…。从推送习惯上可明显看出，每个ID都需“被真正识别”，否则对客户体验很有坏影响。,AppStore,2017-12-1911:15:48
不断进步中…一个ID多个设备要统一推送习惯。这软件在进步…由骂转赞，背后的人辛苦了??一个ID很可能拥有多个IOS设备，而现在，每个设备都被看成“另一个人”…。从推送习惯上可明显看出，每个ID都需“被真正识别”，否则对客户体验很有坏影响。,AppStore,2017-12-1911:15:48
我都没升级界面突然变了是什么鬼更新这个版本后用的好好的关闭后重进突然一下子底部界面就变了我的怎么跑上面了还多了个火山小视频????,AppStore,2017-06-0304:43:03
太好看了，老铁没毛病，赞赞赞,vivo应用商店,2017-11-2316:51:46
非让我点，那我就来点。给你五星好评。行了吧，满意了吧！??,小米应用商店,2017-12-1420:38:10
好很好非常好好很好非常好，可惜安卓没有专业版,AppStore,2017-01-2008:49:13
好评，但是，但是有bug！请尽快更新，iPadPro已经不能分屏了，谢谢！,AppStore,2017-02-1919:54:24
刚买的时候挺好用一年前还是挺好的，看看现在的版本都变什么样了？各种广告，什么小视频，推送的垃圾，各种推荐关注，有意思吗？,AppStore,2017-09-1713:38:22
为什么装的老版本刚开始状态栏还沉浸，关闭头条重新启动之后，整个头条就变成最新版样式，状态栏也不沉浸了？,豌豆荚,2017-10-2223:13:53
花少量时间了解重要新闻实在好,AppStore,2017-02-2806:37:19
ipad的版式能不能优化下建议扎克的版式非常棒，你们的内容和体验非常棒，是否能结合下？,AppStore,2017-01-2111:57:00
很好的一个app给我带来了很多不知道的知识极力推荐,vivo应用商店,2017-12-3112:51:19
流畅度5.9.8的流畅度，还没有之前5.8.4的体验好，希望改到5.8.4的体验感觉！,AppStore,2017-02-2304:31:54
五星评价软件做的越来越好了，但我手机上现在有3个“不知道哪个是新版本。还有，为什么同一软件能同时安装3个呢？”,AppStore,2017-01-2518:38:26
放桌面，每日必修课。很好，内容也较新。,AppStore,2017-02-1710:38:33
广告没了还可以，改了就是好孩子,AppStore,2017-06-0719:13:51
专业收费版应当提供更专业的服务希望给付款专业版提供更好服务！更新后，非常卡！,AppStore,2017-01-0914:34:38
冬天了，我这有我们宿舍妹纸的私房照，需要的话可以找我，伸手党勿扰,应用宝,2017-12-1900:33:23
1块钱没广告真值真是良心非常不错,AppStore,2017-02-2819:17:00
分类的更新提议分类更新，不久没想到真的出现了，希望越办愈好，加油！,AppStore,2017-03-2005:56:44
闪退跟新版本后闪退啊！小编可以用吗？,AppStore,2017-01-0414:09:20
今天怎么一看视频就闪退啊手机问题吗？还有海岛奇兵也是闪退,vivo应用商店,2017-12-2000:33:44
必备,vivo应用商店,2018-01-0115:44:21
A手机必备,AppStore,2017-03-0307:05:17
小报转载记者必备啊小报转载记者必备啊,AppStore,2017-02-0608:06:33
希望今日头条越做越好！今日头条已经成为我生活中的一部分了！,AppStore,2017-02-2822:27:02
大爱头条，离不开了！,小米应用商店,2018-01-0219:06:46
大爱头条,小米应用商店,2017-12-1419:41:14
及时报导、好,豌豆荚,2017-10-2004:21:56
好!及时好,AppStore,2017-01-1518:49:01
更新完就闪退啊什么情况，请及时修复吧,AppStore,2017-01-0414:30:29
Pro这去广告简直不能再值了一直在用头条!每天不刷个十几遍头条浑身不舒服~哈哈，希望2017继续努力~2016年诸位辛苦了,AppStore,2017-01-0616:34:38
每天必看,小米应用商店,2017-11-1719:31:07
关心反腐打老虎苍蝇,豌豆荚,2017-10-2118:56:38
偷听人说话最近也发现聊天提到某些东西，之后今日头条搜索框就会显示提到的东西，。很神奇还有，别根据爱好推内容了，太狭窄了,AppStore,2017-11-1410:58:39
偷听人说话最近也发现聊天提到某些东西，之后今日头条搜索框就会显示提到的东西，。很神奇还有，别根据爱好推内容了，太狭窄了,AppStore,2017-11-1410:58:39
好的这款软件还是非常好用的，用了以后就停不下,AppStore,2017-03-0309:31:29
还可以目前看新闻主要用这个，也不知道为什么，可能就是因为广告和朋友推荐。没给五星因为不是我主动想过来评分的。,AppStore,2017-02-0421:13:07
新闻大多无营养，标题吸引人，内容却没啥,豌豆荚,2017-10-2115:28:10
"无任何期前用费，呗花、任性贷、任性付、京东条白、唯品会、一刻金千、来期分、期分乐等各大商城现提秒到,款贷无押抵免保担两千到五W，一手源资，合作共赢，诚信作操??微RQ七幺零零八九(文字换数字）",应用宝,2017-10-3118:54:55
看到些真实的东西了。了解真像的第一步。,AppStore,2017-01-0316:50:25
妈妈喜欢，我不喜欢。,vivo应用商店,2017-11-1017:33:06
没广告太爽了。没广告啊，加上内涵段子专业版，懂我卡要起飞了。,AppStore,2017-11-2709:20:16
没广告太爽了。没广告啊，加上内涵段子专业版，懂我卡要起飞了。,AppStore,2017-11-2709:20:16
符合规定符合的符合恢复到,豌豆荚,2017-10-2305:45:18
虽然更新的快，但是版本没怎么变，希望软件给人们带来更多的功能，为人们提高更多的方便，比如说说不怎么全面，但是还是给个好的评论，加油，,vivo应用商店,2017-10-1412:23:46
这个非常棒！最近结交了一个大神，是他带着我吵股，让我一个月盈利11万。他威信fat261短线高手，盘前分享涨停票。想要学习和分析吵股的都可以伽他！要是你们也赚了回来给我个赞就好！！,应用宝,2017-10-2517:51:12
非常好的平台就是有时候登陆不上去，不稳定，希望继续改进,AppStore,2017-03-0313:17:26
挺好的，上面的很多推荐都蛮有趣的，就是tm的这几天不知发了什么疯，每次都能看到“答题能挣钱，知识能提现”的脑残广告????,vivo应用商店,2018-01-0723:03:11
好东西，一直用,小米应用商店,2017-11-1719:08:03
好东西生活好伴侣睡前好伙伴,AppStore,2017-03-0313:10:23
好可以v哈哈,豌豆荚,2017-10-1414:42:57
非常不错，有了他基本不看电视新闻了。全面有趣，学习娱乐两不耽误。赞赞赞赞,小米应用商店,2017-10-3019:02:19
很好，有多种功能，而且界面好看不单调,豌豆荚,2017-10-2214:21:47
很好的软件，可是怎么占用储存越来越大了，快1G了，在所有安装的的app中最大，企鹅家都有所优了，没有这么大…希望改进。,小米应用商店,2017-10-1811:20:09
用了两年头条了。感觉非常好玩，新闻娱乐不所不能。给一万个好评。,vivo应用商店,2017-10-2619:38:45
不错不错，天天用,AppStore,2017-02-1623:10:24
增加按压功能啥时候能增加按压功能啊？还有啥时候可以换主题啊？,AppStore,2017-11-2817:26:13
增加按压功能啥时候能增加按压功能啊？还有啥时候可以换主题啊？,AppStore,2017-11-2817:26:13
?这个软件非常好用！在这个世道上能有一起赚的人不多，非常感谢，是他带着我能让我一个星期赚好几千。威信midou9101。如果你们也赚了记得回来给我一个赞！,应用宝,2017-12-0911:52:38
很不错，一直在用内容推送非常精准，基本上上每天都看，停不下来,AppStore,2017-03-0310:28:18
手机发烫只要打开头条一会会，手机就烫的很厉害！,AppStore,2017-02-2113:28:52
好用手机好用，就是容易发热，耗电量很大后台同时开着今日头条和爱奇艺视频，耗电量堪比玩游戏，单独开着爱奇艺就没事儿,AppStore,2017-08-0508:23:30
天天晚上睡觉时必看有空也看天天更新很多看不完而且还会上瘾,vivo应用商店,2017-12-2921:35:06
不错，更新的很快，虽然质量参差不齐，但是也有许多相关兴趣的内容,豌豆荚,2017-10-2220:18:38
挺好的，信息量广而大，全而精！就是内容有些贵族化、低级趣味的东西多，尚待完善！,豌豆荚,2017-10-2220:09:33
现在感觉没有以前那么好，高质量的精品文章太少了，广告也多。,豌豆荚,2017-10-2118:20:50
好玩好看人才多，就是头条很顽固自启。已换用极速版,360手机助手,2017-12-1707:43:51
专业版确实不错感觉与普通版没有太大的区别。,AppStore,2017-01-0220:32:58
还行吧，知识面很全，没有以前的版本好用，咋越更新越差劲了,vivo应用商店,2017-12-3115:29:50
"垃圾很好很强大的软件，推荐大家使用，我喜欢！双击两次赞,我的头像会闪烁！看我头像进群，欢迎进来免费看！！",应用宝,2017-11-0623:49:36
很好虽然每天都会更新好多次…让人产生一种…咦头条怎么有那么多…的感觉，但是很好啦?,AppStore,2017-02-2802:27:27
邮件、通讯之外最重要的app！也许我说的有点夸张，但这确实是我的真实体会！希望头条更上一层楼，你若不离不弃，我便生死相依！,AppStore,2017-02-0912:41:00
新闻很多而且都是最新最快发布的,小米应用商店,2018-01-0220:48:29
"iPhonex点赞没有3dtouch反馈。iPhone7,iPhone8都有，iPhonex竟然没有，之前特别好用的功能，手感很好，竟然没有，出了再改5星",AppStore,2017-12-1417:55:03
"iPhonex点赞没有3dtouch反馈。iPhone7,iPhone8都有，iPhonex竟然没有，之前特别好用的功能，手感很好，竟然没有，出了再改5星",AppStore,2017-12-1417:55:03
推荐的新闻都是些没营养的东西，不推荐！！推荐的新闻都是些没营养的东西，不推荐！！,AppStore,2017-03-0614:48:31
做得好第一次发评论，点赞！每天必不可少的一个软件，新闻、娱乐样样精彩不拖沓。,AppStore,2017-03-0308:17:48
很好，新闻量大,豌豆荚,2017-10-2217:37:37
新闻及时，评论正义值得下载,AppStore,2017-01-1207:40:39
新闻越来越假以前的头条可以看到自己想看的东西，现在广告、内容乱、差马上卸载,AppStore,2017-11-1923:18:32
新闻越来越假以前的头条可以看到自己想看的东西，现在广告、内容乱、差马上卸载,AppStore,2017-11-1923:18:32
今日头条我用了45年了，现在看新闻刷新一下全他妈是悟空问答，之后拉黑悟空问答，好嘛，刷新内容全是悟空问答，我就打开过两三个，之后就疯狂给我推荐悟空问答，现在更好了又多了个喜马拉雅FM，我点开一看啥也没有，那你给我推荐鸡毛啊,小米应用商店,2017-11-0412:22:09
挺好每天了解一点新闻。,AppStore,2017-03-2800:31:21
专业点评从苹果商店下载的软件，??一个奖励1-4块，??等于给软件做了广告。?微??信公众??号wanapp3【如果不显示就点下面搜一搜】一天能收入70左右。??可以直接提现。??真的是棒极了，真心推荐你做！??非常真实靠谱。??,AppStore,2017-01-2611:43:00
各方面都好，就只希望能开通私信,vivo应用商店,2017-12-2123:30:56
很牛，看的都是经济事，哪个哪个城市怎样,vivo应用商店,2017-12-1023:42:48
內容丰富，版面设计清晰。內容丰富，版面设计清晰。,AppStore,2017-01-0912:50:25
不错，一直在用很好用的，我用的社交版，花了一元钱那种。更新内容及时，热点推荐全面。好,AppStore,2017-03-0311:50:00
更新及时内容丰富全面，做的很好，向大家推荐一下；但需要调整一下夜间模式的亮度，系统亮度已经很高了，而调到夜间模式时却太暗了，看起来很费劲的。,AppStore,2017-02-1810:40:15
出现闪退情况加上今天服务器维护,vivo应用商店,2017-12-2000:27:00
不是显示了维护升级嘛，所以今天更新不出来，那些喷的，都不看公告的？,vivo应用商店,2017-12-2923:49:47
完美！！！,小米应用商店,2017-11-1719:08:03
完美,小米应用商店,2017-12-1420:07:49
连接服务器超时，其他软件正常,豌豆荚,2017-10-2205:26:04
wifi下连不上。其他软件都正常,小米应用商店,2017-11-2008:30:09
软件不错，还没广告，喜欢软件不错，还没广告，喜欢。一直使用,AppStore,2017-12-0415:28:16
软件不错，还没广告，喜欢软件不错，还没广告，喜欢。一直使用,AppStore,2017-12-0415:28:16
实名认证安全吗,vivo应用商店,2017-10-2618:53:49
一星保护,小米应用商店,2017-10-1709:17:18
好评全好评，其他客户端新闻软件在颤抖,AppStore,2017-03-0310:30:01
水军是真的多。这么好的软件迟早毁于水军身上,小米应用商店,2017-11-0106:12:17
不错，下载也不慢，还不到1分钟就安装好了。,vivo应用商店,2017-10-1917:33:31
头条有毒每天看，吃饭看，睡觉前看，非常喜欢，非常好的软件,AppStore,2017-03-0309:09:51
这版本有点弱啊打开会黑屏一下在开启希望优化做的更好把启动广告也去了吧对得起pro支持你们,AppStore,2017-01-1222:31:11
一心栈,豌豆荚,2017-10-2202:30:30
所以说免费和付费就是换了个封面？可以，很强??,AppStore,2017-09-1414:14:19
肯定很好啦。,vivo应用商店,2017-10-2618:28:08
头条棒挺好的，每天有空就看头条，信息量多而全面,AppStore,2017-03-0308:41:17
每天必看很好,AppStore,2017-01-2219:34:00
新闻早知道很好，对自己喜欢的，想知道的，有兴趣的新闻能够有第一时间段的了解。会关注下去！,AppStore,2017-01-1818:52:20
不错，希望能做到更好,豌豆荚,2017-10-2116:28:31
相对于其它的软件，天气预报会预报的更准确些，与天气相关的信息也比较全面。同移动公司开通的天气预报一起使用珠联璧合!!!,360手机助手,2017-11-1901:52:56
超级好的希望还能更好,小米应用商店,2017-11-1720:20:54
评论及时、精炼--很好！,AppStore,2017-02-0211:56:18
你关心的才是头条,小米应用商店,2017-12-2416:48:51
非常好，我觉得不错，最近需要急用钱，没办法只能找“火贷款”app申请了，二十分钟就到账，真的很快，朋友推荐个人觉得很好！百分百通过，一点要求也没有，感谢！,应用宝,2017-11-1513:08:58
五星级头条新闻就是精彩，绝伦无比。力挺。,AppStore,2017-02-2103:51:01
炒股全靠他今年赚了7000%加油未来,AppStore,2017-12-0406:09:16
炒股全靠他今年赚了7000%加油未来,AppStore,2017-12-0406:09:16
好吧，很喜欢，八卦很全的，但是要继续努力，更全,豌豆荚,2017-10-2212:47:04
好东西真的好东西,AppStore,2017-03-0204:46:02
说更新没有内容的人，你们仔细看看，都公告了维护升级，在这瞎喷,vivo应用商店,2017-12-2921:11:39
有了这个，其他新闻软件可以省略了！五星好评,AppStore,2017-01-3100:00:11
更新之后出了个大bug,vivo应用商店,2017-12-2918:19:02
更新后只能用手机号了？我QQ关注的哪儿去了,vivo应用商店,2017-11-3021:53:36
哈哈，一直喜欢用,vivo应用商店,2018-01-0816:05:43
有意思这就是个可以吐槽的好地方！,AppStore,2017-03-0207:59:21
EM4AZ复活码复制粘贴，互帮互助哈~,小米应用商店,2018-01-0619:57:22
这是我用过所有天气类软件最好的，撇开界面美观、功能强大不说，天气类软件最重要的是什么？就是天气的准确性，天特别可爱得界面，很适合萌萌哒女生可以看到空气质量，在北京生活的孩子太需要了出行必备。气预报是我用过最准的。不管是刮风下雨，还是下雪降温，准确率都在98%以上。强烈推荐！声明本人绝不是托儿！,360手机助手,2017-11-1901:56:36
全面不错！新闻很快！趣图，笑话应有尽有！,AppStore,2017-02-2809:14:10
多加一些足球方面的新闻足球方面新闻应该再多点，虽然国足方面现有能力差点，但是我们要对他们要有足够的信心。中国加油，中国足球加油！,AppStore,2017-02-0916:18:50
好奇,vivo应用商店,2017-11-2221:30:03
好，在来点有正能量的就好,360手机助手,2017-12-2921:11:23
優質報導、配得五星！自下載＂頭條新聞＂經常在第一時間收到外地重要資訊，可以馬上和身旁朋友或會議中的合作伙伴分享，顯示出個人特出之處，贏得更高度的信譽。並且參考最新之動向，作出合宜的投資策略，取得美好成果！非常感謝！配得五星啊！,AppStore,2017-01-1609:37:03
好的,豌豆荚,2017-10-2313:58:21
pro版没广告了，赞普通的广告很烦人，没广告很清爽，会继续支持,AppStore,2017-01-2701:43:54
好哈哈哈哈,小米应用商店,2017-10-3018:01:50
非常好哈哈哈,vivo应用商店,2017-11-1209:50:20
软件很好用，每天都有关注，还能收藏到一些可用的小技巧，很棒！,豌豆荚,2017-10-1801:47:02
增加3DTouch什么时候增加3DTouch啊！,AppStore,2017-10-3016:42:02
增加3DTouch什么时候增加3DTouch啊！,AppStore,2017-10-3016:42:02
最好最棒的永远是评论,360手机助手,2017-12-2101:16:17
最好的新闻客户端,豌豆荚,2017-10-2304:11:29
一个星期更新两回，我也是醉了。别的都挺好的,vivo应用商店,2017-12-3017:40:06
是当前新闻类客户端最好的，也是大数据做的最好的,豌豆荚,2017-10-2305:21:27
上瘾的举手,豌豆荚,2017-10-2205:31:29
容易上瘾,豌豆荚,2017-10-2218:18:37
每天大部分时间都在刷头圈儿，这玩意儿上瘾啊。,小米应用商店,2017-11-1719:36:27
今日头条和其它视频比较是是最好的。,vivo应用商店,2017-10-1508:58:27
新闻类产品中的最好，没有之一！如题,AppStore,2017-03-0313:37:28
上瘾啊！上瘾啊！,AppStore,2017-02-2817:53:11
都说好就好,豌豆荚,2017-10-2008:20:36
哈哈哈哈大道,豌豆荚,2017-12-2015:28:19
完美很好,AppStore,2017-12-0509:37:35
完美很好,AppStore,2017-12-0509:37:35
很好的娱乐工具有视频有图片,AppStore,2017-03-0311:29:01
新闻真的很多哦,豌豆荚,2017-11-2216:21:44
很多新闻,豌豆荚,2017-10-2123:49:06
很多刷不出来查看关注号刷不出来，查看图片刷不出来，各种刷不出来！什么情况？,AppStore,2017-11-1500:51:55
很多内容都是瞎编的,豌豆荚,2017-10-2117:53:59
很多,应用宝,2017-11-0419:21:40
广告很多,豌豆荚,2017-10-2214:55:30
更新后很多文章的图片加载不出来,豌豆荚,2017-10-2216:19:28
很多刷不出来查看关注号刷不出来，查看图片刷不出来，各种刷不出来！什么情况？,AppStore,2017-11-1500:51:55
看点很多总能找到焦点！,AppStore,2017-03-2821:59:57
屏蔽新闻还要改善，为什么还是6.3.9的版本,小米应用商店,2017-10-3116:40:51
闪退闪退闪退，重要事情说三遍闪退闪退闪退，重要事情说三遍,AppStore,2017-01-0415:03:01
大条很好玩，希望你们也下载。,应用宝,2018-01-0109:29:09
新增的权限就要一大堆，一个新闻客户端，你要干啥！果断不更。,豌豆荚,2017-10-2202:23:15
太好了，这是目前唯一一个从开始下载到现在一次也没有删过的游戏，有很多新闻，和好看的电影推荐，视频的时间也不限很好,小米应用商店,2017-10-3019:20:07
需要BigBang和TTS功能如题,AppStore,2017-05-1617:18:00
在其他应用打的广告好多啊，引起了我的注意,豌豆荚,2017-10-2200:47:43
操作很方便，挺喜欢这点的，给个好评！借款无忧，借款不愁，就用【优贷宝】app，紧急缺钱直接申请，1千到3万额度，半小时就能到账，而且利息超低！是我用过最好的平台了！,应用宝,2017-11-2223:57:44
图片怎么都是空白的啊，只有视频能看，评论能看,vivo应用商店,2017-12-1010:16:11
棒这个app我能看一上午不挪地儿。,AppStore,2017-02-0121:19:35
不错，每天必看现在的新闻篇幅过长能简短精炼就更好了,豌豆荚,2017-10-2104:00:50
最能看到我感兴趣的新闻app,豌豆荚,2017-10-2211:00:49
增长知识,vivo应用商店,2017-10-1922:49:41
为人民服务真正的为人民服务,AppStore,2017-01-0822:54:26
从2014年看到2018，希望头条越来越好,小米应用商店,2018-01-0219:31:51
求算法工程师求算法工程师，作为农民，关于xi的信息一点不感兴趣，求屏蔽，别虚。,AppStore,2017-02-0823:06:42
还是闪退今晚更新的版本还是闪退！,AppStore,2017-09-0123:08:13
五星红旗G,AppStore,2017-01-2421:56:29
